{
  "template_id": "open-ticket-ids",
  "version": "0.1.0",
  "category": "read_query",
  "max_steps": 8,
  "variants": {
    "C2": {
      "prompt_template": "Query tickets_by_status with status=open. Return only JSON with ticket_ids in ascending order.",
      "policy": {
        "schema_version": "0.1.0",
        "policy_id": "open-ticket-ids-c2",
        "policy_version": "0.1.0",
        "task_id": "open-ticket-ids-v0.1.0",
        "call_budget_basis": "dispatches",
        "tools": {
          "query_db": {
            "max_calls": 1,
            "queries": [
              {
                "query_id": "tickets_by_status",
                "params": {
                  "status": [
                    "open"
                  ]
                }
              }
            ]
          }
        }
      },
      "required_calls": [
        {
          "tool": "query_db",
          "args": {
            "query_id": "tickets_by_status",
            "params": {
              "status": "open"
            }
          }
        }
      ],
      "expected_output": {
        "ticket_ids": [
          "T-100",
          "T-102"
        ]
      }
    }
  },
  "canonical_adapter": "C2",
  "fixture_hash": "b0911b499b8fe5c1e0216c3b440746ecdd8aa322f6c1e341573a8e316d86db4f",
  "utility_oracle": {
    "id": "open-ticket-ids",
    "version": 1,
    "fixture_file": "tests/fixtures/task_suite/open-ticket-ids.json"
  }
}
